author,id,link_flair_text,num_comments,score,text,title,upvote_ratio,url,created_datetime,day_of_week,hour_of_day,month,year,was_edited
TheCKMane,1bc72vs,Post-interview,0,1,"I got an awesome job at a great company, however I made the mistake of telling the background check 3rd party company they can contact my previous employer. I worked there for over 2 years and I know the owner well, and I knew he would be hard to get a hold of, but I tried contacting him to tell him about the background check and he even ignored me lol. So he's likely not going to communicate with the background check company. My question is, should I be that guy and just contact the background check company and give them my tax forms? I already contacted HR and they said they haven't heard from the background check company yet, but would let me know if there's an issue. I have my tax forms thank god, but I want to speed this process up, but I also don't want to come off as a ball of anxiety and be annoying. However I know if I give my tax forms to someone then this problem gets resolved. What should I do? I'm sure I'm not the first person in this scenario.","Background check taking forever, it's just one job they can't verify, because the owner never picks up their phone or answers emails.",0.67,https://www.reddit.com/r/jobs/comments/1bc72vs/background_check_taking_forever_its_just_one_job/,2024-03-11 16:19:07,Monday,16,March,2024,False
TiredOfLife90,1bbna8u,Leaving a job,5,24,"So I quit subway after 3 weeks. Owner didn't train properly. Tossed people onto night shift who didn't know how to close out registers. 1 person on their own during the dinner rush, while also being expected to clean and start closing during rush. AND I found out....the store manager was stealing our tips. F all of that. People need to prove they can train and manage, BEFORE being put in charge, I swear.",Quit subway.....,0.78,https://www.reddit.com/r/jobs/comments/1bbna8u/quit_subway/,2024-03-10 22:36:49,Sunday,22,March,2024,False
Hank_Scorpio_MD,1bc6f56,Post-interview,2,1,"Long story short...hopefully I met with the CEO of a prestigious/mid-sized (400-500 employees) excavating company about a project management job. The CEO said he was looking for someone that would hit the ground running at this time. 100% fair. However, he said that I impressed him enough that he'd find a spot for me. Two weeks later (late-January), he sent me over two positions they were in the process of creating. I picked the job I thought would fit best for me and interviewed with the guy I'd be working under along with the VP of the company. That was Feb. 6. I didn't hear anything back so on Feb 22, I emailed the CEO and he said that he heard the interview went great and he'd have the guy who I'd be working under reach out to me that day. He did and this was his reply... > Sorry about the delay and not getting back to you last week after the 2-week follow up discussion we had from when you came in. My world has been hectic busy and unfortunately some situations required my immediate attention. In addition to having a couple days off scattered into the mix, along with leaving for vacation next week, a lot has been going on. With that being said, I have not forgot about you. Unfortunately, the timing has not been ideal from a lot of aspects. However, I feel strongly that there is an employment opportunity available within ABCD Companies. Internally I need clarity on a couple items and need a few more questions answered. With that being said, my goal is to circle back around with you next week prior to me leaving for vacation. I appreciate your understanding and patience with this. I replied with (TLDR version) > Sounds good and completely understood. Hopefully if/when the time is right, we'll have an opportunity to work together! Have a great vacation! --------------------------------- I know it's a brand new position (as he hinted in the ""internally"" part.) They haven't interviewed anyone else for and I know they're in the midst of setting up their 2024 programs and training day so I completely understand/know he's swamped. He didn't get back to me before his vacation and it's now 11 business days since the email quoted above. I'd figure most of those were him being on vacation (spring break with his wife/kid). I mean this is my DREAM JOB for my DREAM COMPANY....I have no problem being persistent but I'm having a hard time getting a read on this and don't want to push too hard but would also like to move on either way.... What are your thoughts? Give him until later this week or early next week before sending a casual email asking for an update? EDIT: I am currently employed so it's not a huge rush to get a new job.",Weird situation: When to reach out again post-interview (possible TLDR),1.0,https://www.reddit.com/r/jobs/comments/1bc6f56/weird_situation_when_to_reach_out_again/,2024-03-11 15:52:38,Monday,15,March,2024,True
BenzoHead,1bc689s,Leaving a job,1,1,"Hey all, Out of curiosity, I wanted to gather some opinions. Would you take a higher paying job that has a lower position title than you have now? Let's say you are a Senior Business Analyst that makes 90k a year but you switch to a Business Analyst position at another company that pays you 120k a year. Would you make the jump even though your title is considered 'lower'?",Higher Pay - 'Lower' Position,1.0,https://www.reddit.com/r/jobs/comments/1bc689s/higher_pay_lower_position/,2024-03-11 15:44:48,Monday,15,March,2024,False
stormpen95,1bc62e8,Career planning,0,0,"The title. I'm now 28 and am planning to switch to biomed, but that's going to involve more time spent on education and qualifications, so what can I do in the meantime? What jobs could I do? Sorry if this sounds stupid, I'm just feeling kind of lost and deseprate rn, but the decision to leave med is the right one for me.",Med student that's decided to leave medicine,0.5,https://www.reddit.com/r/jobs/comments/1bc62e8/med_student_thats_decided_to_leave_medicine/,2024-03-11 15:37:40,Monday,15,March,2024,False
CapricornMonk,1bbdrup,Compensation,171,70,"Title. I get 15 days PTO combined, for both vacation and sick leave. I really miss traveling. I want to live a simpler life. I'm willing to take a pay cut for more vacation time and work life balance. Just curious about what careers or companies might offer this. Edit: I'm in the United States. Edit 2: I greatly appreciate all of your answers!!","People with more than 2 weeks of vacation, what do you do?",0.89,https://www.reddit.com/r/jobs/comments/1bbdrup/people_with_more_than_2_weeks_of_vacation_what_do/,2024-03-10 16:04:05,Sunday,16,March,2024,True
Ok-Spread1305,1bc4rsx,Applications,1,0,I really want a new job. I’m currently doing personal injury law but I feel like something else would be more fitting for me. I like finance and investing and have thought about being a financial advisor or financial planner. I’m also pretty creative and like art and thought about being a wedding or event planner. Does anyone have any other ideas or suggestions? I need help finding for something that pays well but won’t make me cry everyday 🥲,Looking for a new job. Please help!!,0.5,https://www.reddit.com/r/jobs/comments/1bc4rsx/looking_for_a_new_job_please_help/,2024-03-11 14:41:02,Monday,14,March,2024,False
improbablylame,1bc4ac9,Interviews,0,1,"hi all! i made it to the second part of interviews for this job, meaning i guess i passed the first one (phone interview) and now im moving forward to an hour long zoom interview next monday. this job is a pretty steep jump from what i do right now. at the moment im a teachers assistant at a very VERY small school, this new job is a direct billing representative for an insurance company. i have an insane case of imposter syndrome right now. it’s a entry level job, the only things they required were a GED and some experience with microsoft software. i’ve had a knot in my stomach since the phone interview, constantly jumping between “i can do this i need the money and it’s a good opportunity” and “this is a bad idea, im biting off way more than i can chew, i should tell them now im not interested because im going to suck at it”. does anyone have any tips on calming myself over this? or how to at least fake an inkling of confidence. i’ve never even really attended a professional interview before, im allowed to schedule a mock interview and i think ill do that too. i know new job anxiety is a very real thing but constantly feeling like im being hunted for sport isn’t helping me feel sure of myself. any tips would be great. thank you!",tips to get over new job/interview anxiety ,0.6,https://www.reddit.com/r/jobs/comments/1bc4ac9/tips_to_get_over_new_jobinterview_anxiety/,2024-03-11 14:19:19,Monday,14,March,2024,False
Brief_Meringue_531,1bc49uu,Office relations,3,1,"I started this job sometime last year. There were trainings I had to do and a project that took about two months or so. Once that was completed, I was placed on a project. I was told that first projects for new ppl usually take long to kick off. The project I was placed on was suppose to take off really soon but turned out to be slow. I’ve asked ppl on my team if there was anything to help out on and they pretty much told me the same thing I already knew. Not much to do at the moment. The last meeting of the year I had w my manager, I was told I should ask my other manager for work to do and pretty much ask for work to do overall. Now, I’ve worked in tech, healthcare and a few other fields and I’ve never had to ASK for work to do. (This job is somewhat of a cross between tech and science. ) I feel as though they hired me for a job so work should be provided. I told her that. She talked about college/school and being used to having work being provided. I’ve been out of college for 3/4 years so no idea why she brought that up??? So I’ve asked for work and guess what? That work is also slow. In our next meeting she says “if the work isn’t enough to keep you busy, maybe you should ask for some more work to do.” My peers that I got hired w don’t seem to be having this problem..just me. I literally was the first one to be assigned a project too. I probably might end up leaving because this isn’t really my type of environment. I talked to family and friends about this and they would love to have this issue. Their words not mine, but not having stuff to do at work make the day go by slow and I feel pretty useless. Doesn’t make it better having a manager down my neck telling me to ask for work. Have you ever had to ask for work to do at work? It’s so weird to me and a first of many.",Manager said I need to ask for work to do ,0.67,https://www.reddit.com/r/jobs/comments/1bc49uu/manager_said_i_need_to_ask_for_work_to_do/,2024-03-11 14:18:43,Monday,14,March,2024,False
BitterCredit,1bc45cj,Compensation,2,1,"Hi all, As title states. I have a salary review upcoming in June and I'd like to be able to find what the average going rate is. Traffic Engineering Technologist. Seeking additional certifications and possibly pursuing further education. I have been working where I am for a year, new division, and so far its been really good and have had very good feedback from the extremely high up higher-ups. Current salary was based on my experience at the time, and since then I've vastly grown and have become extremely proficient. I'd like to ask in addition to a higher salary, some kind if performance bonus. Complete X amount of plans get X amount of a bonus. I am seeking to also land some huge projects and bring in some more revenue for my division. All in all, looking for guidance to resources i can reference and do some research ahead of time. Located in Ontario, Canada. Much thanks.",Salary Review Upcoming - Where to find the industry average salary for my role/similar ,1.0,https://www.reddit.com/r/jobs/comments/1bc45cj/salary_review_upcoming_where_to_find_the_industry/,2024-03-11 14:13:03,Monday,14,March,2024,False
mathgeekf314159,1bbtme7,Unemployment,3,7,"I escaped a narcissistic abusive parent about a year and a half ago. I also lost my job in November and have been on unemployment since. I worked as a software engineer before ( I have about 2 years exp) and I have both been trying to find jobs in tech and survival jobs. Here is my delema, I have 10 more weeks til my unemployment gets cut off. I have yet to secure employment. The one sure thing I thought was Starbucks never called me back. Best Buy said no to me and so did Verizon. Obviously I applied to a lot more but most never got back to me. I do have a second round interview Monday for a tech job but I know I can't hold my breath and they took 3 weeks just to get the second interview on the books. I also got an assignment for another company that I barely understand and I admit I had to use AI to help me write the solution because they picked the one topic I know nothing about. My mind keeps spiraling to worse case. I know I can't go back in that house with that narcissistic and go back to the abuse. Every day I am crying wondering what is going to happen to me. I need a sure thing. I don't feel safe right now. I have a very limited time frame. No one seems to get that. There are people trying to help but they aren't working fast enough. Nothing is working. I have revamped my resume like 5 different times.I feel stuck. I am crying like every hour. I can't go back. I need a job now! My stress level is constantly at a 9.",I am in trouble and I don't know how I can fix this quickly,0.71,https://www.reddit.com/r/jobs/comments/1bbtme7/i_am_in_trouble_and_i_dont_know_how_i_can_fix/,2024-03-11 03:29:40,Monday,3,March,2024,False
Puddle_Fisher,1bbk9kg,Career development,8,26,"I'll share my story. Long story short company I was working for was paying for my CS education. At this point, I'm 3 years in, and I need to start building projects to go from a department analyst, to have a fighting chance at an interview for a tech analyst shot (a little portfolio). Well, I'll make a long story short, I set up my domain and website. I started really deep diving into the front end, and back end, making DB's, etc also SEO as it was included in a Coursera package. Worked on displaying some portfolio projects, but I wanted a stellar professional personal look. &#x200B; Cut to the chase I wound up needing surgery and was put on disability, no big issue. Since it was early in the semester the college refunded it. The idea was to recoup ASAP and try again next semester. While on disability, my manager got promoted, and I had a new fresh off-boat manager. She was about as sharp as an axe being pounded against concrete all day. She had 0 clue of what I was doing education-wise and promotion. &#x200B; She found my website, and by this time I was learning about linking/crawling so I just had a link to LinkedIn and vice versa, my website on my LinkedIn. By this point I've done such a beautiful job if you google my name, it was the top search result. &#x200B; &#x200B; I got accused of being double employed and working on company time. The unemployment hearing went in my favor.",What's the wildest nonproblematic way you lost a job?,0.9,https://www.reddit.com/r/jobs/comments/1bbk9kg/whats_the_wildest_nonproblematic_way_you_lost_a/,2024-03-10 20:32:37,Sunday,20,March,2024,False
Responsible_Donut779,1bc3rz6,Interviews,1,1,"My company is merging with another, there is a lot of overlap in positions between the two companies. This job has also caused me to burn out and I truly feel like this is the best time to join a new company. The interview process is what is really stressing me out. I currently have a job offer from a job that I am ready to turn down, it just isn’t exactly what I’m looking for. I am also in the process of interviewing for my DREAM JOB. the dream job has moved me on to the next phase of interviews to meet with the owner but the interview “first available” time is 2 weeks from today, 3 weeks from my first interview. My gut is telling me this is a red flag. Is it? I’ve been out of interviewing for 7+ years so I’m not sure if 3+ weeks is a normal interview turn around for companies in the 120+ employee range.",Interviewing process. ,0.67,https://www.reddit.com/r/jobs/comments/1bc3rz6/interviewing_process/,2024-03-11 13:56:07,Monday,13,March,2024,False
Mediocre-Math,1bc3ot7,Interviews,1,1,"I notice the calls are people claiming to be part of home owners association or claiming to be from home energy saving companies. They usually ask yes or no questions like if im a homeowner or ask how im doing (which pisses me off more). If I choose to play along and waste their time how do I go about it without saying ""yes or no"" i heard that some no life scammers try to record an individual saying ""yes"" to steal their voice for identity theft.","Anyone else notice significantly more ""telemarketing calls"" when applying for work? I honestly want to annoy and waste their time but i have more of an urge to be rude tell them to fuck off because im waiting for real phone calls and they waste my time",0.67,https://www.reddit.com/r/jobs/comments/1bc3ot7/anyone_else_notice_significantly_more/,2024-03-11 13:52:00,Monday,13,March,2024,False
Nooneishoome_,1bbkwss,Qualifications,10,21,"I know this may sound ridiculous but please hear me out; as you may have noticed more and more jobs are requiring that you have your own car and drive yourself to work even if having a car is in no way relevant to the job. I understand that it’s to promote punctuality, but I’ve never owned a car and I’ve never once been late to work in four years having been working. The main reason I am unable to get access to a car is I have a sleep disorder. It is regulated and treated enough to a degree that it does not affect my work, but my diagnosis prevents me from legally being able to drive. I personally find these requirements of having a car unnecessary, as I’ve never been late to work as previously mentioned and I’ve known other people who are the exact same way. I’ve seen several remote jobs require that the employee has their own car as well. I somewhat understand as I live in the United States and people argue public transport is unreliable, but I personally have always found a way (absolutely no disrespect to anyone who has struggled as I know how worrisome it can be).",The number of jobs requiring a car,0.97,https://www.reddit.com/r/jobs/comments/1bbkwss/the_number_of_jobs_requiring_a_car/,2024-03-10 20:59:09,Sunday,20,March,2024,False
mule_nag,1bc3idj,Onboarding,1,1,"I've been working in a role for about six months now and still don't have a job title (#startup). This hasn't been a big deal but for Reasons we now need to have titles ASAP. I'm looking for suggestions. Generally this has been a back office role; so far my main tasks & responsibilities have included: - payroll - client invoices - bookkeeping, internal expenses - A/R & A/P - market research - client research - web design - creating pitch decks - writing grant proposals - government filings - purchasing supplies - IT support - HR support - etc. We joke internally that my role is ""other duties as assigned"" — the rest of the group has more defined roles and I'm kind of taking care of everything else. Most of my colleagues have titles like Vice President of [XYZ]. We're a small firm so there's a lot of flexibility, both in terms of possible job titles but also in terms of the evolution of the role itself. Serious and silly suggestions welcome!",Job title ideas?,1.0,https://www.reddit.com/r/jobs/comments/1bc3idj/job_title_ideas/,2024-03-11 13:43:54,Monday,13,March,2024,False
Just-a-guy879,1bc3eus,Job searching,1,0,"By that I mean your own cubicle/desk, coworkers to talk to, office gossip/talk, etc…",What are some job titles that fit the stereotypical office job?,0.4,https://www.reddit.com/r/jobs/comments/1bc3eus/what_are_some_job_titles_that_fit_the/,2024-03-11 13:39:18,Monday,13,March,2024,False
throwawayayay129,1bc33nm,Leaving a job,3,1,"I managed to secure a job starting in September which will be the start of my career (22M) I currently work 4 days a week, long days but I get Fri-Sun off It's more or less minimum wage (UK), but easy work, if boring. I could stay here until August, take some weeks off and then start my career in September. Or, I could find a temp/agency job until August, which would pay more, but I'd have to do more work, probably 5 days a week - I wouldn't work weekends. I do really value having my 3 day weekend, but I could definitely be earning more money, especially with a temp or agency job What would you do?",What would you do in this job scenario?,1.0,https://www.reddit.com/r/jobs/comments/1bc33nm/what_would_you_do_in_this_job_scenario/,2024-03-11 13:24:49,Monday,13,March,2024,False
GangstaHoodrat,1bc338a,Layoffs,3,1,"CEO’s Direct words: “ …I want to be clear, there are no job losses planned as part of this transaction.” From my understanding, acquisitions like this often lead to job losses, I just watched it happen to my sibling. I will admit I’m not well educated in this regard, how much is this messaging to be believed? Tech company btw.",The company I work for  is being acquired by an investment firm,0.67,https://www.reddit.com/r/jobs/comments/1bc338a/the_company_i_work_for_is_being_acquired_by_an/,2024-03-11 13:24:13,Monday,13,March,2024,False
nodaddy-justissues,1bc2w82,Compensation,2,1,"A little back story: I accepted a job at the end of last year for a hybrid position (2 days remote, 3 in office). The pay isn’t great but it’s a job. After starting the job, I learned that the entire rest of the workforce for this role is remote as is the majority of the company. I’m one of the handful of people that come into the office. Annoying, but whatever. It gets interesting when I learned the pay for our role is standard across the org regardless of hybrid or remote. I wasn’t going around asking about pay or anything. We work in recruiting and our ATS doesn’t separate the internal hires from the external ones. Our results are also posted to the entire company. That’s where I saw that the “recruiter-recruiter” posts salary conversations with every candidate she speaks to and that our salary is the same across the board. I had a conversation with my direct leader about the costs of office work vs and she told me I wouldn’t be out of line to reach out to a superior to speak about adjusting my compensation to reflect the differences in time and expenses. I wrote out a very polite, professional email asking if we would be able to discuss the possibility. I was fully prepared for a “no” answer if I got one. I was just shooting a question. I received a phone call later that day from the superior and was taken aback from it. He said he would not discuss others pay with me (which is completely fair, but it’s also publicly posted?) and just kept saying “you signed the contract”. He seemed insulted that I asked. Again, was completely prepared to get turned down but that conversation felt like I was out of line. Was this too much?",Was I out of line?,0.67,https://www.reddit.com/r/jobs/comments/1bc2w82/was_i_out_of_line/,2024-03-11 13:14:29,Monday,13,March,2024,False
StarryEyees,1bc2upi,Post-interview,3,1,"Hi, I’m starting my first post-uni job and I’m a little unsure of what is expected for the dress code. I don’t have much professional looking clothing so just trying to get some ideas of what I need to buy before I start in April. It’s for a marketing role so slightly more on the creative side but is office based. I’ve had two interviews before being offered the job. The people I’ve met during the interview process wore button ups and jeans with trainers and suit jackets (male) and the one woman I saw was in very formal clothing (tailored trousers, blazer etc.) for my interviews I wore skirts/dress with a jumper but that feels maybe too casual to me. Sorry for the long post I may be completely overthinking it I just don’t want to make a bad first impression by coming across either too formal or too casual, so would appreciate any advice thank you.",First corporate job ‘business/casual’ dress code advice (UK),0.67,https://www.reddit.com/r/jobs/comments/1bc2upi/first_corporate_job_businesscasual_dress_code/,2024-03-11 13:12:15,Monday,13,March,2024,False
Kayak_73,1bbpbkj,Post-interview,14,8,What does this mean? That I didn’t get it and they have feedback?,Interview feed back,0.73,https://i.redd.it/b42n7t0djlnc1.jpeg,2024-03-11 00:04:53,Monday,0,March,2024,False
inferno9628,1bbqvjn,Applications,4,10,I'm so sick and tired of applying but always hit with the not selected by employer jobs. I've applied to jobs which I know is a cake walk I have 3 years as paralegal/executive assistant. Is it kinda stupid to require 7-10years minimum in some job postings? I try for those as well but I mainly hit the 3-5years experience preferred.,Not selected by employer ,1.0,https://www.reddit.com/r/jobs/comments/1bbqvjn/not_selected_by_employer/,2024-03-11 01:17:25,Monday,1,March,2024,False
