author,id,link_flair_text,num_comments,score,text,title,upvote_ratio,url,created_datetime,day_of_week,hour_of_day,month,year,was_edited
Forestempress26,1ba2ds6,Office relations,5,0,"So. I have a coworker who is one of the laziest workers I have ever seen in my life. I work a government job but we are contractors, not government employees. It's administrative work and it isn't hard to do. It interests me a great deal because I enjoy the industry the work falls in, and it's a beautiful location, and I'm just overall a great fan. Anyway. I put a lot of effort and pride in the work I do for this job. My coworker, on the other hand, does not. We started the same day. Learned the same things on the same dates, had the same amount of training, etc. She comes in at least 30 minutes late on a daily basis, but usually closer to 1-2 hours. She then sits in her cubicle on her phone, spends another hour doing her hair and makeup, then goes to the bathroom for 20-35 minutes. Comes back, signs on for about 30 minutes. Then lets her screen go blank and sits there on her phone. Every restroom break is at least 20 minutes. (I go for 7 and feel like it was ages) On top of that, she will go for 30 minutes before lunch and say 'I'm going to the restroom before lunch.' be gone for that long and come back, have the audacity to say she's going to lunch. Then takes a 1.5 hour lunch! On top of being an hour late. OMG. We do reports, are contact points for several firms, I have 7 to handle and she has 6. We do weekly and monthly reports. Each month I complete my reports and get them back from my firms while she struggles to even get them started. I feel a lot of stress about this because I like this person apart from work. She is sweet and relatable. And so kind. But her work ethic drives me INSANE. And I can't stop letting it. Her work is separate from mine, but her firms' contact points come to me for assistance, especially if it's urgent, because my coworker will say she is going to do something, something that would take me no more than 30 minutes to complete, and then a week later we get a follow up email requesting it be done, *again,* because she hasn't done it. I feel weird because we do the same exact thing, but for different companies. When we started I felt like I had more drive and initiative to get things done in a timely manner, I started to do everything and didn't give her a chance. We've even had this conversation before because we both felt that way. I started making opportunities for her to do things and would wait 2-3 days for a task that takes me 10 minutes and is the key to completing multiple other tasks, and it wouldn't be done. I'd have to do it myself. So I continue to take on most tasks. But I can't get over the stress of the fact she does nothing. I feel like in some way I don't want her to get in trouble, because she's my buddy, but at the same time, I pray for the day she does get in trouble. I just don't know how to stop obsessing over it. I can't imagine the quality of my work if I wasn't so concerned about her lack if working. \*\*eta\*\* we work in finance, specifically timekeeping. i see the time she wastes and the time she says she works on a weekly basis. am i breaking a law by NOT saying something?",I cannot stop obsessing over the fact that my coworker wastes hours of time and does nothing,0.29,https://www.reddit.com/r/jobs/comments/1ba2ds6/i_cannot_stop_obsessing_over_the_fact_that_my/,2024-03-08 23:12:44,Friday,23,March,2024,False
tiffyquestions,1b9wrti,Post-interview,5,1,Trying to find a better higher paying job for 4 years now and have never been able to get past the first interview. What am I missing/doing wrong? I can't even afford to pay for career coaching and for years I've been working on my interviewing skills and making tweaks as I go along but it's hard to know where you went wrong if you're not getting any feedback. And this is for international remote customer support. At this point it's just hard to believe that I will be able to achieve anything in the future because I've been feeling stuck for years.,4 years of rejection after first round interviews: global remote customer support,1.0,https://www.reddit.com/r/jobs/comments/1b9wrti/4_years_of_rejection_after_first_round_interviews/,2024-03-08 19:25:51,Friday,19,March,2024,False
NumerousLavishness65,1b9we3e,Compensation,2,1,I'm about to negotiation my salary for a new job. As with most large European companies they have extensive parental leave policies. I'll never be a parent. Any experience in negotiating a higher salary as a result?,Salary negotiation ,0.67,https://www.reddit.com/r/jobs/comments/1b9we3e/salary_negotiation/,2024-03-08 19:10:59,Friday,19,March,2024,False
OddSocksRule,1b9wdug,Leaving a job,0,1,"My current situation: I'm a student, I do volunteering, I've been working at the same job for 3 years and I try help manage things at home with my family too. I'm debating quitting my job and I'm giving myself a month to decide. Why I'm thinking of leaving my job: I feel like a screw up. I got promoted and now depending on the rota I run the shift or join my team in doing basic duties. When I do basic duties I'm told I'm too slow. When I run the shift and purely focus on getting everything done on time I'm told I don't care enough about working as a team with the other departments. When I do the extra tasks I'm given and/or anticipate other departments needs despite risking going overtime, I'm told I care too much. Why I want to stay: It's not my job to fire myself for doing a bad job, if I was that bad I wouldn't have been promoted and still have the position after 9 months, if I quit I'll never hear the end of it from my parents, I really like the team, I have good relationships there, I love the routine and student flexibility offered by the job, there's no other weekend jobs available right now and I kinda need the money, I'm in a sort of managment position right now and having it for longer would do my CV good, I like the stability of this job because while I'm studying, training, handling volatile situations at home, this job is constant. I understand that the regional manager is on all of my managers asses right now so they are all just stressed. It feels like there's a communication barrier over how I'm meant to improve because I'm autistic and communicate differently to my managers. If I do decide to stay I need to sit down with my line manager and figure out why they think I'm slow and figure out how they want me to balance being on time and doing extra tasks. Do you guys have any advice? Will things get better or should I jump ship?","Not sure whether quit or not, I feel like a screw up but I still like the job",1.0,https://www.reddit.com/r/jobs/comments/1b9wdug/not_sure_whether_quit_or_not_i_feel_like_a_screw/,2024-03-08 19:10:42,Friday,19,March,2024,False
redditoriousBIG,1b9w6se,Interviews,1,1,"I'm interviewing for an entry level IT role. There are 3 parts to the interview: recruiter, CIO then IT Team. I have a prepaid vacation for 1 week in May with no refunds. At what step of the process should I bring this up? I've already interviewed with the recruiter who sent me onto the next interview with the CIO. We discussed pay already. I definitely feel I should bring this up in the interview as a condition of my accepting the job. I'm just not sure when and to whom I should bring it up to.",Interview process with vacation question ,1.0,https://www.reddit.com/r/jobs/comments/1b9w6se/interview_process_with_vacation_question/,2024-03-08 19:02:57,Friday,19,March,2024,False
2460_one,1b9w2r4,Career development,3,1,"I am hoping to buy a condo very soon, and was relying on a raise to make the condos I want more feasible. It's the time for yearly raises as well as my promotion. I got both at the same time for a total of 7.5%. Which isn't as great as I was expecting (though not bad) but then my manager told me that my bonus % is going from 10% to 20% of my salary with this promotion. Because of that, I didn't think to negotiate my salary (they also presented my salary as set and it didn't seem like I could negotiate it). With my bonus increase, this is a great raise. But the bonus isn't really helping me until I get it March of next year, so I really can't consider that amount in my mortgage payment calculations. It's now been 2 weeks since my pay raise, so I feel like it's too late to negotiate my salary. And it's weird to do so because they're actually paying me well with the bonus. Idk, for people who work at a company with great bonuses, do you consider your bonus as salary or do you think of it as just a one-time payment of extra money (that you don't consider in your payment calculations)? I'm considering applying to different jobs because that's probably the best way to get a good increase. Or, if I get an offer, I could use it as leverage to increase my pay here. I just really want to move out very soon and need some more income soon.","My raise wasn't as good as I was hoping without the bonus, but with it, it's great",0.6,https://www.reddit.com/r/jobs/comments/1b9w2r4/my_raise_wasnt_as_good_as_i_was_hoping_without/,2024-03-08 18:58:53,Friday,18,March,2024,False
rednail64,1b9vzt9,Applications,1,1,"Does anyone have any advice on someone looking to train crows for a living? Specifically I’m looking for a school that would help me train crows to steal money, thereby enriching me.",Crow Training,0.67,https://www.reddit.com/r/jobs/comments/1b9vzt9/crow_training/,2024-03-08 18:55:30,Friday,18,March,2024,False
Icy_Air7727,1b9vfq1,Career planning,0,1,"Hello all. I'm new here, and just found out I'm 4 weeks pregnant with negative 500 in my bank account. I'm a student online and will finish with my associates this fall. What is a career that one could obtain with an associates degree? Do I have any hope? Bonus points if it can be a WFH career. And, before trolls start jumping down my throat, I am interested in WFH because i live in rural alaska off grid in a cabin with an outhouse that uses rainwater collection. I know I will still need help with childcare. I am not from here so am not super familiar with how to earn an income from home. I've been a part time cleaner (independently) since I moved here while going back to school and have always stayed afloat until as of late. Thanks for reading!",Career help??,1.0,https://www.reddit.com/r/jobs/comments/1b9vfq1/career_help/,2024-03-08 18:33:01,Friday,18,March,2024,False
theanxiousknitter,1b9v6u1,Job searching,2,1,"I have the unique situation where I know when my contract is ending. The ending date is just over four months away. (I also have six months of income saved as a buffer so even after the job is done I have some flexibility.) While it’s not a huge rush - I don’t like being in limbo. I really want to start applying and have actually found several jobs that I’m really interested in. However, I don’t want to apply just to waste everyone’s time when I find out that they need someone immediately. What is the best way to go about this? Should I wait? Should I add it in the cover letter? What can I be doing during this time to set myself up for the best success?",When do you start applying when you have an end date for your job?,1.0,https://www.reddit.com/r/jobs/comments/1b9v6u1/when_do_you_start_applying_when_you_have_an_end/,2024-03-08 18:23:23,Friday,18,March,2024,False
iSkyRapture,1b9v6lx,Job searching,3,0,"My wife and I just had our first child recently and I've been looking into remote work so I can be more available to help her. She's a stay at home mom for the set future. I have some office job experience, doing data entry and customer service, but I wanted to know what remote jobs are the easiest to apply for and which ones I should be looking for.",What is the most easily accessible remote job?,0.5,https://www.reddit.com/r/jobs/comments/1b9v6lx/what_is_the_most_easily_accessible_remote_job/,2024-03-08 18:23:10,Friday,18,March,2024,False
kaygee1694,1b9uzn6,Education,0,1,"Does anyone carry a Masters in this field? How is the job search or workforce for you right now? I have a Bachelors in Political Science, however Im interested in getting my masters in this topic. Would you recommend? Yes or no? If no, why not? Also what is your current job position?",Masters in Industrial Organizational Psychology?,1.0,https://www.reddit.com/r/jobs/comments/1b9uzn6/masters_in_industrial_organizational_psychology/,2024-03-08 18:15:51,Friday,18,March,2024,False
TiredOfLife90,1b9ux5u,Companies,0,1,"Since working for dunkin and Subway, I've noticed they both have a thing where employees have to find their own coverage if they call out for what ever reason. Is this a new thing? I had a family emergency yesterday(elderly paren hurt themselves) so I had to call out and STILL the owner of told me to find someone to cover for me. 🤦‍♀️ what happened to the days of that being the manager's job?",Is it a new thing?,1.0,https://www.reddit.com/r/jobs/comments/1b9ux5u/is_it_a_new_thing/,2024-03-08 18:13:10,Friday,18,March,2024,False
Beautiful_Net2409,1b9utve,Office relations,38,1,"I've been really struggling with feeling overestimulated at work, super emotional and exhausted and just wanting to get away. Any background noise just stresses me out. Have not had it before and it really isn't a pleasant feeling when you're stuck to deal with it. Any advice?",Anyone had this feeling?,0.6,https://www.reddit.com/r/jobs/comments/1b9utve/anyone_had_this_feeling/,2024-03-08 18:09:43,Friday,18,March,2024,False
Metropolitana,1b9u6vl,Job searching,0,1,"Hi everyone, I’m from the UK and I left my corporate job at the end of last year. I was essentially forced into an environment by my immature manager until I felt so uncomfortable that I quit (alongside his light suggestion that I should resign). I am confident in my abilities and know that it is a reflection on him, not on me, so leaving was the best thing I could do. I’m struggling to find something despite having 3.5 years of good experience, so I want to try something new but have no idea what to go for or how to sell myself with the current skill set I have. Does anyone have any advice? In the meantime, my rent won’t pay itself and I’m not sure what part time job to get to hold me down. Sounds a bit ridiculous but it’s quite overwhelming with so many options so would love some advice on what to suggest. Thanks!","Left my job, looking for something new",1.0,https://www.reddit.com/r/jobs/comments/1b9u6vl/left_my_job_looking_for_something_new/,2024-03-08 17:44:34,Friday,17,March,2024,False
Living_Complex5749,1b99gpf,Job searching,13,26,"Hi, My sister recently got divorced and has been a stay-at-home mom for about the last 17 years. Before she was a mom, she was a project manager. The major issue that she is dealing with is the 17-year gap on her resume. She has applied to over 1000 job postings over the last couple of months and has not received any interest from any potential employers. Does anyone have any suggestions on how my sister should overcome the large gap on her resume? I feel awful that I can not do anything for her. I would appreciate any advice you could give me. Also, thank you for reading this, and I wish you luck in your job search.","Trying to help a recently divorced stay-at-home mom with 17-year job gap, get back into the workforce.",0.94,https://www.reddit.com/r/jobs/comments/1b99gpf/trying_to_help_a_recently_divorced_stayathome_mom/,2024-03-08 00:03:00,Friday,0,March,2024,False
JustAnotherDude2024,1b9tnvq,Job searching,0,1,"A little background on me: I worked in digital marketing for a few months before I was laid off due to covid. I then started my own art business which I have ran for over three years now. Now, I’m trying to get into a sales role. Preferably SDR / BDR since I know those are usually entry level. However, I have applied to hundreds of jobs and have had basically no luck. I interviewed with one company and even made it to the final stage, but never heard back afterwards. I also have a phone call interview with a recruiter for another company next week, so I’m crossing my fingers that that goes well. Is there any tips you all have for landing a first job in sales? I’ve already started reading books on sales and everything so that I’m not completely dumbfounded when I land a job. And I also have some sales experience from running my own business.",How can I start a career in sales? ,1.0,https://www.reddit.com/r/jobs/comments/1b9tnvq/how_can_i_start_a_career_in_sales/,2024-03-08 17:24:07,Friday,17,March,2024,False
MooseGoose82,1b9nur7,Leaving a job,3,2,"Senior Manager leaving a company after 18 months. Getting what amounts to four weeks of severance per year of employment. The company doesn't pay out much PTO by policy, which sucks, because I didn't get to take much and I'll lose that. On paper, reason for departure is that my work doesn't align with the work available in the company. This is 100% true. Off paper... My boss wants me out and this is a good way to do it. The non-compete is a fairly light 12-month one. Basically can't touch any clients I actually worked on. It's not as ugly as some I've seen, where if I did business development for a client I can't do that at my next firm. Do I really need to get an attorney to review this? It seems like a waste of money. I'm getting severance out of a company that normally doesn't pay severance. While that doesn't feel generous given that I'm leaving my PTO on the table, they have zero incentive to negotiate with me anyway. I freely admit I'm not important enough for that.",Separating from my company on neutral terms. The severance package seems adequate. Do I need to pay an attorney to review this?,1.0,https://www.reddit.com/r/jobs/comments/1b9nur7/separating_from_my_company_on_neutral_terms_the/,2024-03-08 13:25:05,Friday,13,March,2024,False
Just-a-guy879,1b9t7sv,Career development,18,0,"I wanted to see what the most common office jobs were. I don’t really know what I wanna do or really have a specific talent or skill. So if I do something everyone else does then I’m likely to be pretty good at it to. I’m 20 so I can still go to college and all that if a degree is required, but a regular job doing regular stuff I guess fits. Thanks in advance.",What are some really common office jobs?,0.5,https://www.reddit.com/r/jobs/comments/1b9t7sv/what_are_some_really_common_office_jobs/,2024-03-08 17:06:24,Friday,17,March,2024,False
kb1r,1b9t47q,Leaving a job,1,1,"I’ll be resigning for the first time from a job I’ve only had for 3 months- I’ve found another, much better opportunity and would like to leave while I’m still on probation. I’m a bit nervous about this & had the following questions 1. How often do people really quit on probation? I see people in my firm resign but feel like I’m the only one leaving this soon. 2. Is it okay to tell your employer you’ve found a better opportunity, which will be more aligned with my future? Or would it come off as offensive? Thank you!",Resigning for the first time ,1.0,https://www.reddit.com/r/jobs/comments/1b9t47q/resigning_for_the_first_time/,2024-03-08 17:02:34,Friday,17,March,2024,False
peachpepperpop,1b9sty9,Career planning,2,1,Please drop down your advices. Would really appreciate it.,"If an individual has a keen interest in corporate law and aims to build a future in this field, which laws or acts should they prioritize studying?",1.0,https://www.reddit.com/r/jobs/comments/1b9sty9/if_an_individual_has_a_keen_interest_in_corporate/,2024-03-08 16:51:19,Friday,16,March,2024,False
musteatpoptarts,1b9sqj3,Applications,2,1,"So I’ve been I my industry for the past 13 years. It’s fine, I love it but like some jobs, it’s pretty slow. Some days I don’t go in and other days it’s a short day. I wanted to pick up doing something super new for some extra money. There’s a brewery opening up and I wanted to apply but I don’t exactly have a resume to send them when applying. At least not anything that is along the same lines experience wise. How do you navigate that or word it to let them know I’m capable? I work with the public, I sell product, book appointments. Thank you.",How to make some extra money in something new ,1.0,https://www.reddit.com/r/jobs/comments/1b9sqj3/how_to_make_some_extra_money_in_something_new/,2024-03-08 16:47:34,Friday,16,March,2024,False
Brooklinebeck,1b9sotp,Job searching,2,1,"My nephew (28) lives with me in Florida and has been trying to get a job. He is on the spectrum, overweight, and hasn't has a job in 5 years. He doesn't have a driver's license or a GED but he is working towards both. He has been applying to entry level positions like fast food restaurants and as soon as they see him in person they tell him the position is filled. What can he do to get someone to hire him? What kind of job should he try to get? He'd trying but he's getting very frustrated.",Nephew needs a job,0.67,https://www.reddit.com/r/jobs/comments/1b9sotp/nephew_needs_a_job/,2024-03-08 16:45:45,Friday,16,March,2024,False
Head-Practice7751,1b9irtl,Job searching,0,5,"Guys, I really need your help I completed my engineering in 2023 and had offers from ltimindtree but due to me wanting to pursue MBA, I left that and recently my dad passed away and it is my duty to support my family, if you can please help me find jobs or refer me for jobs in Delhi NCR region it would be of help. Please if you can just upvote it that would be help too.",Guys I need your help please ,0.86,https://www.reddit.com/r/jobs/comments/1b9irtl/guys_i_need_your_help_please/,2024-03-08 07:57:28,Friday,7,March,2024,False
Fit-Mix7636,1b9sb0s,Leaving a job,1,1,"I need a bit of advice. I’m currently in an accounting role as a nursing student (I kiiiiiind of lied to them about my area of study, I told them I’m going for accounting, they have no idea I’m in nursing school, I just really needed a job at the time). I make $17.50 an hour, I took a pay cut because again, I just really needed a job. I don’t hate the job itself, I just hate sitting at a desk all day, I hate the stacks of papers, I hate the teams meetings, I dislike corporate and I find it weird that everyone cares what everyone is wearing. I hate the spreadsheets. I’m almost always off task (usually on YouTube unless my manager walks into my office) I hate sending mail. Accounting sucks and I’m just not a finance person lol. However, I just recently accepted an offer at a Dermatology Clinic as an MA, they know I’m in nursing school and my rate is $22/hr. I start not this monday but next monday. I just need different perspectives. I was thinking of quitting without notice to have about a week of time to study and focus on nursing school, because I did fail my midterm last week and I have a lot of important and high stake exams coming up that I want to lock in for. Would it be a good idea to quit without 2 week notice because I have something else lined up? I just finished out the current pay period.",Quitting without 2 week notice,0.67,https://www.reddit.com/r/jobs/comments/1b9sb0s/quitting_without_2_week_notice/,2024-03-08 16:30:32,Friday,16,March,2024,False
kendall1287,1b9saei,Job searching,0,0,"So I (36M) have a decent full time day job and am relatively comfortable, but I am looking for a job, preferably an active job like unloading a truck or working in a warehouse, where I could make a little supplemental income but, more importantly, where I could participate in an ESPP that matches your contributions. I have already looked at Walmart and Home Depot as both do matching, but I can't really think of any other businesses that do this where you can get hired without a degree. I know Lowe's has one but they do not match so it is functionally worthless to me. Other benefits like a 401k or tuition reimbursement (not like Walmart where it has to be a degree that directly benefits the company, but one where you can actually CHOOSE where you go and what your degree is and just get reimbursed) would be nice, but not really necessary, the big one is ESPP with matching contributions at least up to a percentage. The one kind of job that I am not interested in is a job where I have to interact with the general public in any way. Done enough of that for 5 lifetimes, but other than that as long as it's a job that can be done super part time, like 5 or 6 hours per week, and meets the ESPP requirements that I listed, I would be interested.",Super part time job with certain benefits,0.5,https://www.reddit.com/r/jobs/comments/1b9saei/super_part_time_job_with_certain_benefits/,2024-03-08 16:29:58,Friday,16,March,2024,False
