author,id,link_flair_text,num_comments,score,text,title,upvote_ratio,url,created_datetime,day_of_week,hour_of_day,month,year,was_edited
xXxLostBunnyxXx,1bak34k,Leaving a job,9,10,"I'm generally a very friendly and optimistic staff and after joining a position with frequent turnover (quite a number of them quit within the 6-month probation and historically no one stays beyond a year.), I've turned into a shell of I was. I was stressed and the absence of proper management left me at a continued state of confusion to the point where I was frequently crying, having disturbed sleep and little stressors trigger my frustration and anger (makes me snarky/curt but I have never yelled or shouted profanities or insulted anyone). My supervisors managing me gets transferred out every few months and I keep having to rebuild relationships with new supervisors. And many new staff kept coming to me privately for help because no one knows anything, and I had the longest tenure rate (over 6 months) in the room. My issue now that has broke my mind was that the 3rd supervisor has written me up and logged every incident when I have been curt and not myself, and brought it to my 4th supervisor to warn her that I am a toxic staff in a meeting with me, when it was my burnout symptoms that I had little control over. I do agree that my irritability is unprofessional but please tell me how can I smile through the stress and pretend to be all cheery when I am drowning in work every single day. I am ashamed at what I have become and my other ten years of work experience never logged such incidents. Even though I was unhappy, I just kept to myself and did not bother anyone. The good thing is that my colleagues privately check in frequently on me because they know how much stress I was under. After that ""warning"" meeting with the two supervisors, I woke up an hour before my alarm the next day in a crying fit and had to take the day off. As my bouts of crying and sense of helplessness has been prolonged past 4 months, the doctor has preliminarily diagnosed me with burnout. Today I woke up at 6am and started crying when my mind ruminated the meeting. Can someone please tell me if this is normal? Why are the ones that work the hardest and burntout always labeled as toxic? I can't control my outbursts and I've never been like that in previous jobs.",Burntout at work but boss marked my symptoms as being toxic ,0.86,https://www.reddit.com/r/jobs/comments/1bak34k/burntout_at_work_but_boss_marked_my_symptoms_as/,2024-03-09 15:21:10,Saturday,15,March,2024,False
Trying_ToDo_Betterr,1baw4th,Interviews,0,2,"I will be interviewing at SEI, specifically within the Investment Management Services Tech team. I was hoping if anyone had any advice on common technical interview question for such positions? I have not worked within a development role at a financial services/investment company so any help or tips are appreciated!",SEI- Investment Management Services Tech Intern Interview,1.0,https://www.reddit.com/r/jobs/comments/1baw4th/sei_investment_management_services_tech_intern/,2024-03-09 23:55:53,Saturday,23,March,2024,False
slowngnawing,1bb0lfc,Interviews,16,3,The interview is 130 miles a way with traffic it would likely take me close to 3 hrs to get there. Ive done multiple video interviews for them but this final one I guess they want to be face to face. It feels very interview heavy considering I already got the stamp of approval from the CEO.,Is it a red flag that a company did not offer to pay for me to travel for interview?,0.64,https://www.reddit.com/r/jobs/comments/1bb0lfc/is_it_a_red_flag_that_a_company_did_not_offer_to/,2024-03-10 03:36:14,Sunday,3,March,2024,False
DrivenToSuccess-01,1bb0h3x,Applications,1,0,"I’m about to become homeless if I don’t find a job in a month. I lost my job 2 years ago due to an injury (non-work related, not at-fault car accident). I’m doing better now so I’m looking for a new job. Literally any type of job that will make me at least $2400 a month. Where do I start? I’ve had 2 job interviews but then one company ghosted me and the other went with another candidate with more relevant experience. What do I do?",Master of Healthcare Admin and BA in Psychology and Biology. How do I find a job in Los Angeles ASAP? Urgent.,0.5,https://www.reddit.com/r/jobs/comments/1bb0h3x/master_of_healthcare_admin_and_ba_in_psychology/,2024-03-10 03:29:37,Sunday,3,March,2024,False
MammathMoobies,1bave7q,Interviews,1,2,"Applied to a job and had an HR screening. Went well. Said I'd be getting a follow up by one of their colleagues for a meeting with the hiring manager. Sick. Colleague emails me on Wednesday, we'll call him Evan. Evan asks me for a few times that work for me next week. I responded back, but I called him Devan. Never heard back. Seemed like a pretty good gig too. On to the next one. &#x200B;",Typo Cost me a Gig,0.67,https://www.reddit.com/r/jobs/comments/1bave7q/typo_cost_me_a_gig/,2024-03-09 23:23:19,Saturday,23,March,2024,False
Ready-Caramel8693,1bazv4w,Applications,13,1,I will be turning 16 in May but want to get a head start on finding a job since everyone will be looking for summer jobs around that time. What are some tips you guys have for someone finding their first job? And tips for applying/interviews as well!,Best way to get a job at 16?,0.57,https://www.reddit.com/r/jobs/comments/1bazv4w/best_way_to_get_a_job_at_16/,2024-03-10 02:58:15,Sunday,2,March,2024,False
R_u_seriousss,1bazuwz,Applications,0,1,"So I’ve been having some bad luck. I was in college during a majority of covid so a lot of internships were closed, the majority of internships I wanted that are in my industry wants a junior or senior in college. I graduated last year and I can’t get an entry level job so I’ve been applying for internships and most of them have declined me, I think it’s because I graduated last year and they want a junior/senior. Can I lie in my resume and say I’m still in college, how deep will they do a background check for it?",Should I put in my resume that I’m still in college?,1.0,https://www.reddit.com/r/jobs/comments/1bazuwz/should_i_put_in_my_resume_that_im_still_in_college/,2024-03-10 02:57:54,Sunday,2,March,2024,False
ApplicationUsed9912,1bahvk6,Onboarding,17,10,"Is it normal to progressively care less and less about your work at a place you’re leaving during a two week notice? I feel like this is probably obvious. Today is my last day working at my job. Been working 60 hour weeks and I did pretty good the last week or week and a half, but I’ve not done too much the last couple of days.",Is it normal to quit caring while working two weeks notice. ,0.86,https://www.reddit.com/r/jobs/comments/1bahvk6/is_it_normal_to_quit_caring_while_working_two/,2024-03-09 13:35:27,Saturday,13,March,2024,False
Junior_Welcome6209,1baz1mn,Career development,1,0,"Hey everyone, I started a mentorship program with the dean of the college I’m currently attending in August of 2024. During my time with my so called mentor, I fell like I haven’t received what I needed from said mentor. There is 4 of us in this mentorship and she basically doesn’t really pay us the attention like she’s supposed to, since the start she’s being saying very condescending things to me like “I know you’re ready to leave this meeting” in which I would respond “no I’m not” she thought I didn’t know how to use tools such as excel or canva (which I have proven time and time again that I do). Here recently, I called her to have a private conversation with her about my current situation (I’m looking for a full-time job due to the fact I’m behind on a few of my bills) in which she took the conversation and told everyone in the meeting what was going on with me after I expressed that I would not like for that to occur. Now I’m 8 months into my mentorship with her, she recently resigned from being the dean of the school I’m attending ( I believe she got fired), and now we aren’t having weekly meetings like we usually do or anything it’s like all operations have stopped. Could someone please let me know if this is normally how mentorship’s go cause I’m a little confused?",What are mentorship’s supposed to entail?,0.5,https://www.reddit.com/r/jobs/comments/1baz1mn/what_are_mentorships_supposed_to_entail/,2024-03-10 02:16:01,Sunday,2,March,2024,False
Its_christina__,1bay89p,Promotions,2,1,"So I work for Best Buy. I've been with the company in different sectors since 2018. Best buy retail and health mainly. Recently I relocated to a different store and I've been thriving as usual. Recently there was a supervisor roll that opened and my Area manager actually came to me and said he thinks I would be a great fit. I sat on it for a couple days then decided to apply. Received and interview invite then and there were 4 other candidates being considered. Did the interview touched on some of my areas of improvement and asked job related questions. After the interview I returned to the floor and an hour later I was called in again. And was told I got the job. Woot woot. For me. But the human and me thought well there's other people who have worked that department way longer than I have. Why weren't they chosen. I guess ik nervous to step into the roll but at the same time excited for the new challenges it presents. Anything I can do to make it a smooth transition? PS. On supervisor came to me and said. ""your interview was merely a formality, they said they would automatically hire you if you applied""",Promoted over other Tenured employees. ,1.0,https://www.reddit.com/r/jobs/comments/1bay89p/promoted_over_other_tenured_employees/,2024-03-10 01:34:47,Sunday,1,March,2024,False
Pokemonndaycare,1baxw9e,Office relations,2,1,"I have signed arbitration or jury trial waivers for 3 diff jobs. Every time I asked for arbitration, everyone refuses. It was for small things like pay problems, preferential treatment, and saying the job made me feel suicidal. LOL. Those claims are still enforced under contract rules so I asked HR why we can't arbitrate? I'm following policy. Are you allowing me and the other employees to pursue similar claims in court? I only email so there's evidence of refusal to arbitrate. I don't actually go to jury trial since it's obviously for petty claims. But, I save it in case there's a BIG claim.",Anyone else love messing with employers over arbitration claims?,0.6,https://www.reddit.com/r/jobs/comments/1baxw9e/anyone_else_love_messing_with_employers_over/,2024-03-10 01:18:51,Sunday,1,March,2024,False
flaminhotyenta,1baxenc,Post-interview,1,1,"I had my first job interview ever this past week and it went really well. I was told it was a good interview by the director, but I didn’t advance to the next round. In their email to me, the director and assistant director told me that while they were moving forward with different candidates that I should keep an eye out on job postings as they will be hiring other positions in the same division soon. Is this encouraging about their perception of me? Or is this typical for employers to say?",Prospective employer told me to watch for new postings… good sign or typical?,0.66,https://www.reddit.com/r/jobs/comments/1baxenc/prospective_employer_told_me_to_watch_for_new/,2024-03-10 00:55:09,Sunday,0,March,2024,False
No_Radio_5751,1baxcvu,Compensation,1,1,"Okay, so right now I make 87k after a midyear adjustment, after starting at 84k last year. However, last year we received a letter about our market value, which for me said I should be worth 96,662. This was when I was still making 84k. Essentially, I'm undervalued 15% below market value for my role. That means if I had started out at my true market value, I'd be making 100k right now. Another thing to note is that we're supposed to receive our raise this month retroactive to January, and this should be anywhere from 2.5-5% based on what I heard last year. So assuming I get the same adjustment as I did mid year last year, I'll be making 90k (although if I were at market value I'd be making nearly 104k). Needless to say this has been bumming me out but I recently found a role in my company with a range of 92-119k. It's a slightly different role, but close enough that I feel I could negotiate on the higher end given my experience and market value. I'm really hoping my company wouldn't lowball me, especially since I'm 15% under where I should be right now, but my thought is 110k. What do you think would be the most reasonable salary to ask for and why?","Given I get this offer, what would be the most reasonable salary to negotiate?",0.99,https://www.reddit.com/r/jobs/comments/1baxcvu/given_i_get_this_offer_what_would_be_the_most/,2024-03-10 00:52:49,Sunday,0,March,2024,False
skittylover666,1bawz8f,Job searching,1,1,working while disabled in the US hey guys is anyone else disabled and unable to work? i'm rlly trying to find a remote flexible job but they don't want college drop outs and disabled ppl. i only have customer service in food industry jobs as experience. i've been trying to get a slot in DORS. anyone else try this? any advice? i honestly have a lot of trauma but still might have to do sex work because i can't find any way to live. because i need a job to live and idk what yall do in this situation. i don't qualify for ssdi. currently going back to school but i won't be able to pay unless i get a job. any qualifications and licenses i can get easily online?,working while disabled in the US,0.67,https://www.reddit.com/r/jobs/comments/1bawz8f/working_while_disabled_in_the_us/,2024-03-10 00:35:08,Sunday,0,March,2024,False
Outrageous-Phone-919,1bawvnp,Interviews,4,1,"Hey everyone, so on Friday I had an interview for a receptionist at a dental clinic, they asked the standard questions.... ""why do you want to work here?"" ""what made you leave your last job?"" etc etc and it went really well. The guy interviewing me said that he'd be really happy to hire me and that he's love for me to be a new addition to the team, he said a whole bunch of nice things along the lines of being mature for my age, smart and extremely hardworking. He said I'd be hearing back from him in a few days. Fast forward to today, he called and his attitude had completely changed, he went on to mention that the age different between me and the current employees could cause an issue and that he didn't know if someone of my age could handle the stress and tension that their work environment brings. I was quite caught off guard as hehe seemed impressed by me on Friday. He said that he had multiple other candidates to interview and kept bringing up my age and how many people in my generation don't like to work and how the older generation doesn't like to be told what to do by us young ones. What happened here?",A complete shift in attitude? ,0.67,https://www.reddit.com/r/jobs/comments/1bawvnp/a_complete_shift_in_attitude/,2024-03-10 00:30:37,Sunday,0,March,2024,False
Quiet_Perception_367,1bb1b97,Office relations,15,0,My coworker left suddenly and without notice. There are two rumours about why. The first is that she stole a ham. The second is that she stole an item from a customer and was convicted in court. The second is more believable. Is it acceptable to ask her directly why she left? Should I ask her close friend instead or not ask at all? I want to contact her for another reason which is to ask about a colleague I am having trouble with. This coworker left shortly after I joined so I never really got to know her.,Can I ask coworker why she was fired?,0.38,https://www.reddit.com/r/jobs/comments/1bb1b97/can_i_ask_coworker_why_she_was_fired/,2024-03-10 04:15:27,Sunday,4,March,2024,False
Tsukiparu,1bawrog,Job searching,0,1,"Hey all! i work a regular day job, but I was wondering if there are any online **legit** jobs to do just to make some extra money? I’m in college so it it would be nice to be able to make more then just my regular job, Thanks so much !",Online work,1.0,https://www.reddit.com/r/jobs/comments/1bawrog/online_work/,2024-03-10 00:25:31,Sunday,0,March,2024,False
notxenoz,1baw5e4,Unemployment,4,1,"Before 16, I was super excited to get a job, but had to get a surgery at 16. Now that I’ve recovered, for the past 3 months, I’ve been trying to get a job ANYWHERE. I’ve applied at so many restaurants and stores with fairly flexible hours (I think) and asking for any position needed. Do I have to lie about having experience or something? I’m so desperate for a job. Luckily I make a bit of money from my own endeavors (which all goes into savings), but I really want/need a consistent source of income.",I’m 18 and can’t get a job,0.67,https://www.reddit.com/r/jobs/comments/1baw5e4/im_18_and_cant_get_a_job/,2024-03-09 23:56:36,Saturday,23,March,2024,False
wtfinnen,1b9vics,Applications,255,219,"22M. Just graduated college in Dec 2023 with a BA in Media Production/Communications. I won’t beat around the bush. I did the bare minimum in college. I was not blessed enough to be completely taken care of and lived on my own/worked close to full time my whole college career. This left me almost no time to network, join clubs, build a resume/portfolio, etc.. My resume solely consists of my BA, and a couple of restaurant jobs, one of which I am still working. I thought just having the degree would open up a lot of doors but I’m quickly realizing this is not the case. No one wants to hire a 22 yr old white male with zero experience in a corporate environment. Did I waste my time going to college? What advice do y’all have in regards to finding a decent job? I live in Houston, TX. Edit: Many thanks to those who have replied with helpful and insightful advice. I’m well aware that this situation is my fault, and I’m willing to accept that my own laziness got me to this point. To those of you calling me entitled, that could not be further from the truth. I don’t expect anything to be handed to me, and I never said that either. I’m simply looking for honest advice on how to pull myself out of this situation. Once again thank you to those who have given me realistic and feasible solutions! Edit 2: I didnt mean to imply that this solely a race thing. If I did, I apologize. I was merely stating that it’s a (small) factor. DEI exists. This isn’t news.",Is a bachelor’s degree on its own not good enough anymore?,0.82,https://www.reddit.com/r/jobs/comments/1b9vics/is_a_bachelors_degree_on_its_own_not_good_enough/,2024-03-08 18:35:55,Friday,18,March,2024,True
oregonegirl,1banowb,Work/Life balance,0,3,"I have been working as a Peer Support Specialist in a community mental health walk-in day center. If like many others you don’t know what a Peer Support Specialist (PSS) is, here is a [useful overview]( My position at the center can and does sometimes include confronting folks who are elevated/dysregulated/symptomatic in order to maintain safety for the other Peers in the space. A few weeks ago I stayed over an hour late on Friday afternoon after failing to find someone shelter for the weekend. We are not required or encouraged to take breaks and lunch as required by law. I make $16/hr, and my only benefit is a tiny bit of PTO. The level of responsibility I have to assume there is so completely out of alignment with my compensation that bailing has been the only sane choice. There’s simply too much that’s not working for me. So instead I took a job at a retail giant you know and love for $.50 cents more an hour where I’ll be stocking and folding clothes and organizing dressing rooms. Nobody screaming in my face about the first amendment meaning I can’t stop them from traumatizing everyone in a ten foot radius, not being told “I can see right through you, you’re terrible at masking”, nobody punching the windows, there won’t be any “taking breaks” from the building to come back and be a nightmare all over again. There will be process, policy, and procedure. There will be someone above me making decisions about what to do if any of these things ever do happen and it won’t come down to /me/. Sure, the panties will never truly be done, and casual thoughtlessness can be hurtful, but if someone ever starts screaming at me again, it won’t be on me to help them regulate themselves. I never thought I’d be so happy to go back to a soulless corporate overlord but there are some alternatives that are far worse.",Going Back to Corporate,1.0,https://www.reddit.com/r/jobs/comments/1banowb/going_back_to_corporate/,2024-03-09 17:55:36,Saturday,17,March,2024,False
k3wfr,1baw10f,Compensation,1,1,"I live in the state of california and work as a part time server who makes hourly + tips. I normally am scheduled to work 3 days a week. Recently i had an injury and received a doctord note that says I cant work for 6 weeks, and my employer is refusing to give me sick pay despite me having accumulated sick days to use. Their reasoning is that the law only functions that if I am scheduled and call off due to being sick, I am entitled pay but since im not being scheduled, I won’t get paid. Is that allowed? If not, please site a California code that I could show my employer. Thanks",Employer not providing sick pay??,1.0,https://www.reddit.com/r/jobs/comments/1baw10f/employer_not_providing_sick_pay/,2024-03-09 23:51:10,Saturday,23,March,2024,False
DrinkEspresso,1bavzzf,Leaving a job,5,1,"I am currently fully remote for a company making 70k. The past 6 months have been going downhill as some co-workers have been throwing me under the bus for the team missing deadlines, producing poor quality work, the project manager telling management that the blame is all on me, etc. Yesterday, I been offered a new job making 80k but it would required me to be in the office 2 days a week and the commute time is 10 minutes. The new job is relatively more boring than my current job and there’s no career advancement. I really love being fully remote and the perks that come with it but I’m at the point where I do not want to stay at this job anymore with backstabbing team members who will throw you under the bus to save themselves. If you were me would you leave or stay and fight it out?",Am I crazy for wanting to leave fully remote job for hybrid?,1.0,https://www.reddit.com/r/jobs/comments/1bavzzf/am_i_crazy_for_wanting_to_leave_fully_remote_job/,2024-03-09 23:49:59,Saturday,23,March,2024,True
boyopuffs,1b9tjef,Leaving a job,113,274,"I am involved with technology specifically AI and have been involved with AI for over 10 years at this point. My former boss (Canadian Indian who I worked for 10 years - I am white European - we are pals) and I built the system. It is very, very complex and the workflow is even more complex. It is used in a very regulated and controlled environment. My boss left in November to start his own software company. He told me to cool my jets, you will be joining me at some point. Anyway I got this new guy (Indian) in November since he left. I have been the in-charge since my boss left. In January this guy sends me an email about outsourcing this system to an Indian company. I told him that it cant be done. We already use them for tier 1 support and they can barely do it. They can barely add users without screwing it up. Than about 4 weeks ago he schedules a call with me and a bunch of other people to talk about this application and handing it off to this Indian company AGAIN. I put together a deck explaining what it does in simple language and I went to the end users who gave me feedback about handing this off to this Indian company. They were vehemently opposed to doing this - I just put their feedback in the deck. Nothing about my opinion, just their own words. The manager was pissed beyond belief. I could see it at the meeting, it was all over his face. I got word a few days later from another guy that this guy was livid that I spoke to the end users without speaking to him first. How I embarrassed him that he did not know they end users hated this company. Keep in mind that for 3 months this guy has barely spoken to me. Than about a week ago with no warning they laid me off. I was not the only one - there were about 100 people. They told me at the notification that my job was eliminated. Than I found out they gave my job to this other Indian guy job who has no experience in this. He is also about 15 years younger than me. I spoke with the guy and he played stupid that he had no idea that this was going to happen. Yeah sure. People that I work with were totally shocked at what happened. Everyone is saying its retaliation and its obviously not job performance. I see 3 things going on here: 1. Racism - the IT here is about 80% Indian at this point. 2. Ageism - the guy is 15 years younger than me 3. Retaliation - because he was mad and I opposed the outsourcing. Some people have told me that I should sue them. They offered me severance but I have to sign away all my rights. I am not sure what to do at this point.",Laid Off By Indian Manager & Replaced With His Indian Friend With Less Experience,0.84,https://www.reddit.com/r/jobs/comments/1b9tjef/laid_off_by_indian_manager_replaced_with_his/,2024-03-08 17:19:02,Friday,17,March,2024,False
