author,id,link_flair_text,num_comments,score,text,title,upvote_ratio,url,created_datetime,day_of_week,hour_of_day,month,year,was_edited
AutoModerator,1b5wc20,Weekly Megathread,52,8,"This is the weekly success and disappointment Megathread for the week. Please post all of your successes and disappointments for this week, including job offers and other victories, as well as any venting of frustration, in this thread, and this thread only. Thanks!",Success and Disappointment Megathread for the Week,1.0,https://www.reddit.com/r/jobs/comments/1b5wc20/success_and_disappointment_megathread_for_the_week/,2024-03-04 00:00:17,Monday,0,March,2024,False
AutoModerator,1bbp7r7,Weekly Megathread,15,3,"This is the weekly success and disappointment Megathread for the week. Please post all of your successes and disappointments for this week, including job offers and other victories, as well as any venting of frustration, in this thread, and this thread only. Thanks!",Success and Disappointment Megathread for the Week,1.0,https://www.reddit.com/r/jobs/comments/1bbp7r7/success_and_disappointment_megathread_for_the_week/,2024-03-11 00:00:27,Monday,0,March,2024,False
khalashtar,1bc9fku,Article,41,533,"To preface, I have already put in my two weeks and was about halfway through. I made a post a couple of days ago detailing how my boss chewed me out over getting help from a coworker. After that day, I thought everything was said and done till the next morning when my boss once again called me into his office. He accused me having coworkers in MY office (like, why am I getting in trouble? I didn’t invite them, and regardless I have an open door policy and love to help and answer questions where I can. Also, I was leaving in about a week, so people would often stop and talk or say goodbye) for FOUR HOURS. If anything, the few coworkers who DID stop by were there for 10-15 minutes at most, and would stop by from time to time for various reasons. Then, after I tried to reason and defend myself and my coworkers, he cut me off and told me it looked bad on me and that upper management had made comments. After that, he said something that absolutely shocked me: “you know, we didn’t have to keep you after you put in your two weeks. But we vouched for you.” Keep in mind, the only reason I put in two weeks to begin with is because its the professional thing to do. I have another job lined up. I would have loved to just quit lol. This was the bullshit I was tired of. I was shocked and nearly in tears. There was another person in his office awkwardly sitting there. I was overall just humiliated. After I left his office I cried a bit in my own office and packed all my belongings because I was debating walking out. I thought about it over the weekend and decided I would just flat out quit on Monday morning, which I did. He was shocked? How can you be shocked after lowkey waving the threat of being fired around? Either way, I’m glad to be out. I start my new job in two weeks 😊",I quit on the spot at my office job.,0.98,https://www.reddit.com/r/jobs/comments/1bc9fku/i_quit_on_the_spot_at_my_office_job/,2024-03-11 17:53:09,Monday,17,March,2024,False
Burntmonkeys69,1bc3py4,Internships,139,497,"Note: second slide is a list of notes (excuse my bad handwriting) when I got a call back after an interview I had with them at a career fair. They told me they were impressed with my resume, and asked if I was worried about my GPA falling below a 2.5, and they told me this is a 30 minute online meeting to meet with the hiring managers to see what position is in my best interest and what would fit me best. They also asked if they would need to know anything that would raise concern on a background check or drug screening. Imo I feel like it sounds all like good news, like I have the job in the bag but I’m not positive",Is this good news?,0.86,https://www.reddit.com/gallery/1bc3py4,2024-03-11 13:53:31,Monday,13,March,2024,False
Eastern-Cauliflower9,1bcc16f,Interviews,39,113,"There is a job position for a team member who will be under my leadership. However, the selection process is not solely up to me, but three additional people on the interview panel. One candidate didn’t make it to the interview portion of the interview stage solely based on a panelist rejection based on them being gender fluid and queer, and the main factor was the candidate was an older male who would make them uncomfortable. Now as I had time to ponder I feel like I just engaged in employment discrimination.",I was just in an employment screening for a candidate who was then denied due to age and gender,0.84,https://www.reddit.com/r/jobs/comments/1bcc16f/i_was_just_in_an_employment_screening_for_a/,2024-03-11 19:35:51,Monday,19,March,2024,False
krakoan,1bc596e,Work/Life balance,111,168,"I've been working from home since 2019 and I have a question for all those who commute to work now or in a hybrid setting in Canada or the US after being 100% remote. If you have a 1.5-hour transit commute to your workplace that starts at let's say 9:30 AM. You'll have to begin your day at least 6:30 AM and return home by 8 PM to 9:30 PM. If you sleep at IDK maybe 12 or 1 AM that's 5 to 6 hours. How is life now after being 100% remote? And this may not apply to those who love going to the office. Do you think your life would be better mentally, and physically just because you don't have to physically go to work? Lack of proper sleep, being able to manage your life around work at home. I may have a new job opportunity that requires 3 days in the office and increase to 4, I just keep feeling like I would be wasting my life if I start going to the office again.. (forget the pay and money) thoughts? &#x200B;",9 to 5 Work Life after 100% Remote,0.9,https://www.reddit.com/r/jobs/comments/1bc596e/9_to_5_work_life_after_100_remote/,2024-03-11 15:02:06,Monday,15,March,2024,False
Esteven69,1bbpba1,Interviews,194,2662,Is this a thing Hampton calls people when people apply to their company?,Well then.,0.95,https://i.redd.it/f5bh930bjlnc1.jpeg,2024-03-11 00:04:33,Monday,0,March,2024,False
SteakClear6596,1bcmfrn,Rejections,16,12,"Got five rejections today. Haven't worked for the past 6 months. Everytime I always get this damn message. ""While we were impressed with your background and experience, we have concluded that we will not be moving forward at this time with your application."" Or ""It’s clear that you have an impressive background with valuable skills and experiences. However, we have decided to move forward with another candidate at this time."" It's all a headache and heartache. I just don't know what to do. Don't think I'll be able to make rent.",I just don't know what to do anymore.,0.94,https://www.reddit.com/r/jobs/comments/1bcmfrn/i_just_dont_know_what_to_do_anymore/,2024-03-12 02:46:33,Tuesday,2,March,2024,False
BrainWaveCC,1bclipt,Interviews,12,12,"I am thoroughly astounded by the number of recent posts where new employees are surprised about what the job entails. I'm not talking about those who were told *""you will be doing* ***X****""* but they are now clearly being asked to do **Y**. I'm talking about the folks that are totally bewildered by what their work experience looks like in the first place -- all that it entails. Did they not understand that they were supposed to try and get as much info about the specifics of the role during the interview process, including what would be expected of them, and how their performance would be evaluated? Are did they just assume that whatever was in the job description was the sum total of what the job would entail? Or that if the name of the role was one that is familiar to them, then the work would be totally familiar as well? Maybe it's just me... Please... Ask detailed questions of the people on the other side of the table/screen/etc. Not just about pay and benefits -- which are important considerations -- but about the daily workflow, what orientation and onboarding look like, what the expectations will be for the first week and month, and what success would look like after a year in this role. Ask about the areas where previous employees have struggled, and what would be needed to avoid those pitfalls. This is not just so you will know what success looks like (from their perspective), but you will have a sense of if it is the kind of success you want to be pursuing. That's a major objective of the interview process for the candidate -- know what you are getting into. *(BTW, this is why giving your salary requirements at the beginning of the interview process, before you have figured any of this out, puts the candidate at a disadvantage. How do you know if a job is worth $50K or $70K to you, if you don't know what it entails beyond the flimsy job description?!?)*",Do candidates realize they're supposed to use the interview process to find out what they're going to be expected to do if they get the job?,0.73,https://www.reddit.com/r/jobs/comments/1bclipt/do_candidates_realize_theyre_supposed_to_use_the/,2024-03-12 02:03:06,Tuesday,2,March,2024,False
Key_Swordfish5271,1bc66mt,Applications,45,69,I’m seriously getting close to giving up and dropping out of my college course that I’m 2 years into . Applied to 30+ jobs and nothing not even a reply . Also absolutely zero financial support from the college bursery and I’m not eligible to claim universal credit because I’m a full time student. And I also don’t get any financial support from my parents other than not having to pay rent which I am very grateful for everything else I have to pay myself so I’m struggling to feed myself and afford bus fare . My mental health is going down the drain . Why is it so difficult to get a job I have retail experience and hospitality experience.,I’m getting absolutely no where with my job search.,0.9,https://www.reddit.com/r/jobs/comments/1bc66mt/im_getting_absolutely_no_where_with_my_job_search/,2024-03-11 15:42:53,Monday,15,March,2024,False
shippingdepartment,1bbc2k7,Post-interview,275,7806,I got so tired of getting rejection emails that I sent a rejection email to one of the companies that I didn't want to work for.,I sent them a rejection email.,0.94,https://i.redd.it/n4vtv1jdsinc1.jpeg,2024-03-10 14:50:03,Sunday,14,March,2024,False
Odd_Parking_6286,1bcibf2,Career planning,9,12,"Maybe you hit a a certain level and thought ""this is good I don't want to go any higher up on the ladder."" I know some places don't promote quickly or easily, which is one method to avoid promotion. Also, not going above and beyond helps I assume. How do you not ""ruin"" your career? What if you WANT to hold a lower level position for the rest of your working life? Does getting older make you feel like people discriminate or treat you different due to your age and the fact you don't have a more senior title? Have you run into any perks/downfalls?","People who don't want to be promoted any higher, how do you do it without looking bad?",0.89,https://www.reddit.com/r/jobs/comments/1bcibf2/people_who_dont_want_to_be_promoted_any_higher/,2024-03-11 23:41:48,Monday,23,March,2024,False
Treehugging_sme,1bcai86,Leaving a job,13,32,"I have been in my current job for a little over 4 years but it’s been a toxic cesspool for about a year and a half. I’ve made it through 4 layoffs but it’s gotten to a point where they’ve created an unbearable work environment coupled with impossible metrics that can’t be met unless someone works 12 hour days, 7 days a week. (I’m salaried) How do I know? Because that’s what it’s taking me to meet the demand and I’m not a newbie at this. I’ve been actively applying to jobs so I can get out of here for about a year. I’m 55 and have been in my field since 1997, plus I have a BS degree that I completed in 2017. I also have several certifications. That said, I took all my experience from LinkedIn and my resume for anything prior to 2015. I have been declined by every single job I’ve applied to, including an employer I was at for over 5 years right before my current job. They laid everyone off and sent our jobs overseas which is the only reason I left. It’s pretty scary when you can’t even get an interview even when you’re working. I’m freaking out. 😩",Job Searching at 55 Is A Whole Other Level Of F*ckery.  ,0.96,https://www.reddit.com/r/jobs/comments/1bcai86/job_searching_at_55_is_a_whole_other_level_of/,2024-03-11 18:35:51,Monday,18,March,2024,False
SentientThermostat,1bcjme8,Companies,24,9,"I’m 24, being recruited after graduating from college 2 years ago and working as a driving instructor. I currently make $16.25 an hour which isn’t bad for my area. NWM is telling me the average person earns $100k in their first year. I find that to extremely hard to believe. Essentially they’re telling me I’m special and have the potential to make $1M per year at age 40, which I kind of scoffed at. Anyone have any experience with this company? Do I have a bad recruiter or is this completely a scam?","So….Northwest Mutual is a scam, right?",0.81,https://www.reddit.com/r/jobs/comments/1bcjme8/sonorthwest_mutual_is_a_scam_right/,2024-03-12 00:37:53,Tuesday,0,March,2024,True
bad-in-plaid,1bcibmc,Leaving a job,9,12,"I was laid off in December by a company where I worked for over 7 years. It was a true shock. I was sad and scared, and threw myself into applying and interviewing for every job posting I could find. I had a lot of interviews but also a lot of rejections. A couple weeks ago, I was offered a job by a company that requires 5 days a week in the office, and is a 90 minute commute from where I live, neither of which are ideal to say the least. It paid about the same as I was making before being laid off, which translates to a loss when you factor in the long commute and office time. I agonized over whether I should wait for something better to come along, but they gave me only two days to decide on the offer (and refused to extend more time) and wanted me to start within the week. It was an offer and I've been unemployed for months, so even though they wouldn't negotiate on the salary, I accepted the job and started last Friday. Here's where the trouble started. On Friday afternoon, after a welcome lunch bought by my new colleagues, I got a call from a company I had interviewed with weeks before and had assumed I was no longer under consideration for. They offered me the job (same title) at a higher salary, and fully remote. I think it's a better fit for my skills and certainly for my lifestyle. It's a no brainer for me to accept. But now I'm going to have to quit on my third day on the job at the first company. It's an extremely small company (5 people) and I'm their first hire who they haven't had a prior relationship with. They're all extremely nice and have been so kind and welcoming. I know I'm putting them in a bad position, as they hired me so quickly because they're extremely busy, and they wasted time and money hiring and onboarding me. I am in a 90 day probationary period where I'm able to quit or be terminated without notice, so technically I'm in the clear, but morally I feel awful about it and I'm worried about what the consequences might be for future job searches. The time after my layoff has been the worst in my life and this is really just adding another layer of awfulness. I know I have to do what's best for me in the end but just hoping to maybe hear some reassurance that I'm making the right decision. I've never actually had to quit before, the company that laid me off was my first adult job. Any advice on how to do so gracefully in this situation without making things even worse?",Quitting on the 3rd day for a better offer...,1.0,https://www.reddit.com/r/jobs/comments/1bcibmc/quitting_on_the_3rd_day_for_a_better_offer/,2024-03-11 23:42:03,Monday,23,March,2024,False
CelestialMoonbeam,1bcm90i,Interviews,2,5,"Set an interview on Friday for Monday @ 3pm. Anticipated it all weekend, and made sure I was ready for the questions. It was for a photography/video assistant. The interview time slot was for 45 minutes. She calls me on Monday and first thing she asks if why I applied for this role and why do I want to work at this company. I tell her that I love photography and am new to this city and have heard that this company is amazing to work for. She proceeds to tell me that my resume is catered for a graphic designer (that’s where my experience has been) and almost got flagged out of their system, but she saw it and looked at my portfolio and “it’s amazing!” I’m feeling good about this, but then she proceeds to let me know that I’m not really a fit for this role and that I’m more suited for a design role. She said that my portfolio is one of the best she’s seen in the area in a while but that my skills would be better utilized as a designer and not a photographer. But she wasn’t offering me a position as a designer, or saying maybe in the future that’s a possibility, she was just letting me know that information. Like?? I just don’t understand the point of this “interview”. I have a lot of photography skills and took 2 classes in school for it, but she was not interested in hearing about my photography experience at all. The call lasted 6 minutes total. I tried to be very polite and thank her for her compliments and time, but I truly don’t understand the point of putting me through this process?? I did decide that I’m going to take applying at jobs slower and be sure to make a resume more catered toward the position I am applying for. I am also making a photography portfolio that’s separate from my design portfolio so atleast I’m gaining something from this experience. But I truly don’t understand why they didn’t just deny me if I wasn’t qualified for the role in their eyes??? TL;DR - Lady called me to compliment my graphic design portfolio and tell me I’m not fit for their photography role and I don’t understand the point",Person called me for an “interview”…,1.0,https://www.reddit.com/r/jobs/comments/1bcm90i/person_called_me_for_an_interview/,2024-03-12 02:37:36,Tuesday,2,March,2024,True
Jumpy-Promotion-6525,1bcqk92,Job searching,0,2,"Hey everyone, I'm looking for some online work that I can do remotely for couple hundreds a month, I can dedicate 3 4 hours a day What options do I have?",How to make 500$/month online,1.0,https://www.reddit.com/r/jobs/comments/1bcqk92/how_to_make_500month_online/,2024-03-12 06:34:01,Tuesday,6,March,2024,False
OverallPatient2607,1bcaml8,Layoffs,12,16,"So today after having above average review organisation, I got to know that I had been given needs improvement rating for last year review cycle, where I even got meets expectation in the mid year review, and never such low review before in this org. The reason I was given was I was found to be replying late on TEAMS to my peers. Although I know who this year was and I confronted him where it was told that the issue for just a week and since then their has been no such concern ever again which even my manager also got to know from him that the improvement has been there and no such concern ever after. Though the peer told the delay was around an hour or two for that week, when I asked my manager to approximately quantify it, he didn't. Just said this was the reason for negative review, and though as documented by them they were judging my performance in past 4 months which did showed improvement he said they would be coming up with an action plan for a month(basically PIP). I understand I have to start looking my way out but having less than 2YOE, job market isn't easy right now, considering my present job was really high paying. Should I go for PIP or resign as soon as they come with it, considering notice period is 6 weeks( if they allow me to serve all 6 weeks), to have as minimum career gap as possible. Ps: Also if anyone of you have been in the same place how do you manage the mental trauma and turmoil after you know you did everything for the job but still manage out from a nice paying job in this market.","Got PIP for absurd reason, should I go for it or resign to minimise career gap untill get hired",0.87,https://www.reddit.com/r/jobs/comments/1bcaml8/got_pip_for_absurd_reason_should_i_go_for_it_or/,2024-03-11 18:40:49,Monday,18,March,2024,True
Tech_Astro,1bcp3ht,Resumes/CVs,2,2,"I am 16 years old I got fired from my job, if you want to know how (oh boy it's preeeeetttyyy wild) let me know. I just want to know. Will it affect my ability to get another one in the future? P.S don't know what flair to put this under P.P.S first time poster.",I got fired from my first job and worried about future jobs.,1.0,https://www.reddit.com/r/jobs/comments/1bcp3ht/i_got_fired_from_my_first_job_and_worried_about/,2024-03-12 05:02:18,Tuesday,5,March,2024,False
space_love2,1bcil8j,Onboarding,6,6,Do anybody have advice? I have no experience in doing this,I got a job as a phone sex operator and I start tomorrow ,0.71,https://www.reddit.com/r/jobs/comments/1bcil8j/i_got_a_job_as_a_phone_sex_operator_and_i_start/,2024-03-11 23:53:14,Monday,23,March,2024,False
Dramatic_Lunch3275,1bcm90g,Interviews,8,3,"I just got an email from a government agency asking if I would like to interview for an opening they had. Upon reading the position requirements, the main one I did not meet was having a drivers license. Unfortunately for me, my disability does not allow me to obtain and possess a driver license. Other than that, I meet the education requirements and experience. What would you do? Should I pass on this opportunity?",What is a good way to approach this situation ?,1.0,https://www.reddit.com/r/jobs/comments/1bcm90g/what_is_a_good_way_to_approach_this_situation/,2024-03-12 02:37:35,Tuesday,2,March,2024,False
wa_tl,1bcos9l,Temp work,0,2,"Started my job with enthusiasm but things started going downhill 2 months in. It was a job I was excited for, but things happened: 1. New colleagues joined my team within a span of 1 month. My manager then told me to stop doing what I was doing so that they can practice. That was also the very last time I did that job scope. 2. I no longer have a defined job scope and have been assigned ad hoc tasks like file sorting and assisting other teams with document scanning. The only consistent task remaining is scanning documents. The only consistent job scope I still have till today is the one which requires scanning. 3. Noticed that my team no longer loop me in emails, hence I totally have no involvement in the daily work. Sometimes, I'm also not aware of company events, as my mentor/manager only selectively inform me about it. 4. My boss invited the 2 new colleagues for lunch, but not me because I am a ""temp"" here under agency contract. 5. My annual leave entitlement is significantly less than other staff, and my boss has criticized me for taking sick leave, even when I was genuinely ill (I only took total of 3 days). There was a lack of concern from my boss when I explained my situation, and instead, they questioned my absence to my colleagues. For the past five months, I’ve been stuck doing menial tasks unrelated to my actual job while feeling undervalued and demoralized. It’s taking a toll on my mental health, and although I’m hesitant due to the job market, I’m seriously considering resigning.",Feeling demoralised everyday at work,1.0,https://www.reddit.com/r/jobs/comments/1bcos9l/feeling_demoralised_everyday_at_work/,2024-03-12 04:44:43,Tuesday,4,March,2024,False
TheAmazingGrippando,1bbrgtm,Post-interview,94,263,"What does this mean? The recruiter wants a 15-meeting to give me “feedback” on the interview. I think this is good, right? I’ve never had a feedback meeting after an interview.",What does this mean? Feedback meeting?,0.93,https://i.redd.it/kfb60gkd1mnc1.jpeg,2024-03-11 01:45:50,Monday,1,March,2024,False
CombProfessional434,1bcfaie,Unemployment,4,7,"I've been trying to work on myself more since leaving my toxic job, but since I left I have still been applying to jobs practically every day (except weekends) . Almost like replacing my old job with a new job, but of course without pay and benefits. Yet almost three months in of doing a lot of searching I am starting to just feel burnout. I do live in a smaller city so I can only see a handful of different jobs near me anyway. After nearly getting at least one interview a week I am just getting burnt out. Is it okay to take some days off or should I stay on the grind?",Is it frowned upon to take breaks from job searching?,1.0,https://www.reddit.com/r/jobs/comments/1bcfaie/is_it_frowned_upon_to_take_breaks_from_job/,2024-03-11 21:41:46,Monday,21,March,2024,False
